<?xml version="1.0" encoding="UTF-8"?>
<!DOCTYPE aptech SYSTEM "external.dtd"> 
<aptech>
    
<staff department="HR">
    <id></id>
    <name></name>
    <email></email>
    </staff>
    <staff department="HR">
        <id></id>
        <name></name>
        <email></email>
        </staff>
    <students>
        <id></id>
        <name></name>
        <course></course>
    </students>
</aptech>